title,authors,published,pdf_url,abstract
ContextQFormer: A New Context Modeling Method for Multi-Turn Multi-Modal   Conversations,"Yiming Lei, Zhizheng Yang, Zeming Liu, Haitao Leng, Shaoguo Liu, Tingting Gao, Qingjie Liu, Yunhong Wang",2025-05-29T05:41:26Z,http://arxiv.org/pdf/2505.23121v1,"Multi-modal large language models have demonstrated remarkable zero-shot abilities and powerful image-understanding capabilities. However, the existing open-source multi-modal models suffer from the weak capability of multi-turn interaction, especially for long contexts. To address the issue, we first introduce a context modeling module, termed ContextQFormer, which utilizes a memory block to enhance the presentation of contextual information. Furthermore, to facilitate further research, we carefully build a new multi-turn multi-modal dialogue dataset (TMDialog) for pre-training, instruction-tuning, and evaluation, which will be open-sourced lately. Compared with other multi-modal dialogue datasets, TMDialog contains longer conversations, which supports the research of multi-turn multi-modal dialogue. In addition, ContextQFormer is compared with three baselines on TMDialog and experimental results illustrate that ContextQFormer achieves an improvement of 2%-4% in available rate over baselines."
Elicit and Enhance: Advancing Multimodal Reasoning in Medical Scenarios,"Linjie Mu, Zhongzhen Huang, Yakun Zhu, Xiangyu Zhao, Shaoting Zhang, Xiaofan Zhang",2025-05-29T05:39:23Z,http://arxiv.org/pdf/2505.23118v1,"Effective clinical decision-making depends on iterative, multimodal reasoning across diverse sources of evidence. The recent emergence of multimodal reasoning models has significantly transformed the landscape of solving complex tasks. Although such models have achieved notable success in mathematics and science, their application to medical domains remains underexplored. In this work, we propose \textit{MedE$^2$}, a two-stage post-training pipeline that elicits and then enhances multimodal reasoning for medical domains. In Stage-I, we fine-tune models using 2,000 text-only data samples containing precisely orchestrated reasoning demonstrations to elicit reasoning behaviors. In Stage-II, we further enhance the model's reasoning capabilities using 1,500 rigorously curated multimodal medical cases, aligning model reasoning outputs with our proposed multimodal medical reasoning preference. Extensive experiments demonstrate the efficacy and reliability of \textit{MedE$^2$} in improving the reasoning performance of medical multimodal models. Notably, models trained with \textit{MedE$^2$} consistently outperform baselines across multiple medical multimodal benchmarks. Additional validation on larger models and under inference-time scaling further confirms the robustness and practical utility of our approach."
Dataset Cartography for Large Language Model Alignment: Mapping and   Diagnosing Preference Data,"Seohyeong Lee, Eunwon Kim, Hwaran Lee, Buru Chang",2025-05-29T05:33:46Z,http://arxiv.org/pdf/2505.23114v1,"Human preference data plays a critical role in aligning large language models (LLMs) with human values. However, collecting such data is often expensive and inefficient, posing a significant scalability challenge. To address this, we introduce Alignment Data Map, a GPT-4o-assisted tool for analyzing and diagnosing preference data. Using GPT-4o as a proxy for LLM alignment, we compute alignment scores for LLM-generated responses to instructions from existing preference datasets. These scores are then used to construct an Alignment Data Map based on their mean and variance. Our experiments show that using only 33 percent of the data, specifically samples in the high-mean, low-variance region, achieves performance comparable to or better than using the entire dataset. This finding suggests that the Alignment Data Map can significantly improve data collection efficiency by identifying high-quality samples for LLM alignment without requiring explicit annotations. Moreover, the Alignment Data Map can diagnose existing preference datasets. Our analysis shows that it effectively detects low-impact or potentially misannotated samples. Source code is available online."
OMNIGUARD: An Efficient Approach for AI Safety Moderation Across   Modalities,"Sahil Verma, Keegan Hines, Jeff Bilmes, Charlotte Siska, Luke Zettlemoyer, Hila Gonen, Chandan Singh",2025-05-29T05:25:27Z,http://arxiv.org/pdf/2505.23856v1,"The emerging capabilities of large language models (LLMs) have sparked concerns about their immediate potential for harmful misuse. The core approach to mitigate these concerns is the detection of harmful queries to the model. Current detection approaches are fallible, and are particularly susceptible to attacks that exploit mismatched generalization of model capabilities (e.g., prompts in low-resource languages or prompts provided in non-text modalities such as image and audio). To tackle this challenge, we propose OMNIGUARD, an approach for detecting harmful prompts across languages and modalities. Our approach (i) identifies internal representations of an LLM/MLLM that are aligned across languages or modalities and then (ii) uses them to build a language-agnostic or modality-agnostic classifier for detecting harmful prompts. OMNIGUARD improves harmful prompt classification accuracy by 11.57\% over the strongest baseline in a multilingual setting, by 20.44\% for image-based prompts, and sets a new SOTA for audio-based prompts. By repurposing embeddings computed during generation, OMNIGUARD is also very efficient ($\approx 120 \times$ faster than the next fastest baseline). Code and data are available at: https://github.com/vsahil/OmniGuard."
Generating Diverse Training Samples for Relation Extraction with Large   Language Models,"Zexuan Li, Hongliang Dai, Piji Li",2025-05-29T05:21:54Z,http://arxiv.org/pdf/2505.23108v1,"Using Large Language Models (LLMs) to generate training data can potentially be a preferable way to improve zero or few-shot NLP tasks. However, many problems remain to be investigated for this direction. For the task of Relation Extraction (RE), we find that samples generated by directly prompting LLMs may easily have high structural similarities with each other. They tend to use a limited variety of phrasing while expressing the relation between a pair of entities. Therefore, in this paper, we study how to effectively improve the diversity of the training samples generated with LLMs for RE, while also maintaining their correctness. We first try to make the LLMs produce dissimilar samples by directly giving instructions in In-Context Learning (ICL) prompts. Then, we propose an approach to fine-tune LLMs for diversity training sample generation through Direct Preference Optimization (DPO). Our experiments on commonly used RE datasets show that both attempts can improve the quality of the generated training data. We also find that comparing with directly performing RE with an LLM, training a non-LLM RE model with its generated samples may lead to better performance."
MAP: Revisiting Weight Decomposition for Low-Rank Adaptation,"Chongjie Si, Zhiyi Shi, Yadao Wang, Xiaokang Yang, Susanto Rahardja, Wei Shen",2025-05-29T04:56:35Z,http://arxiv.org/pdf/2505.23094v1,"The rapid development of large language models has revolutionized natural language processing, but their fine-tuning remains computationally expensive, hindering broad deployment. Parameter-efficient fine-tuning (PEFT) methods, such as LoRA, have emerged as solutions. Recent work like DoRA attempts to further decompose weight adaptation into direction and magnitude components. However, existing formulations often define direction heuristically at the column level, lacking a principled geometric foundation. In this paper, we propose MAP, a novel framework that reformulates weight matrices as high-dimensional vectors and decouples their adaptation into direction and magnitude in a rigorous manner. MAP normalizes the pre-trained weights, learns a directional update, and introduces two scalar coefficients to independently scale the magnitude of the base and update vectors. This design enables more interpretable and flexible adaptation, and can be seamlessly integrated into existing PEFT methods. Extensive experiments show that MAP significantly improves performance when coupling with existing methods, offering a simple yet powerful enhancement to existing PEFT methods. Given the universality and simplicity of MAP, we hope it can serve as a default setting for designing future PEFT methods."
Infi-MMR: Curriculum-based Unlocking Multimodal Reasoning via Phased   Reinforcement Learning in Multimodal Small Language Models,"Zeyu Liu, Yuhang Liu, Guanghao Zhu, Congkai Xie, Zhen Li, Jianbo Yuan, Xinyao Wang, Qing Li, Shing-Chi Cheung, Shengyu Zhang, Fei Wu, Hongxia Yang",2025-05-29T04:51:56Z,http://arxiv.org/pdf/2505.23091v1,"Recent advancements in large language models (LLMs) have demonstrated substantial progress in reasoning capabilities, such as DeepSeek-R1, which leverages rule-based reinforcement learning to enhance logical reasoning significantly. However, extending these achievements to multimodal large language models (MLLMs) presents critical challenges, which are frequently more pronounced for Multimodal Small Language Models (MSLMs) given their typically weaker foundational reasoning abilities: (1) the scarcity of high-quality multimodal reasoning datasets, (2) the degradation of reasoning capabilities due to the integration of visual processing, and (3) the risk that direct application of reinforcement learning may produce complex yet incorrect reasoning processes. To address these challenges, we design a novel framework Infi-MMR to systematically unlock the reasoning potential of MSLMs through a curriculum of three carefully structured phases and propose our multimodal reasoning model Infi-MMR-3B. The first phase, Foundational Reasoning Activation, leverages high-quality textual reasoning datasets to activate and strengthen the model's logical reasoning capabilities. The second phase, Cross-Modal Reasoning Adaptation, utilizes caption-augmented multimodal data to facilitate the progressive transfer of reasoning skills to multimodal contexts. The third phase, Multimodal Reasoning Enhancement, employs curated, caption-free multimodal data to mitigate linguistic biases and promote robust cross-modal reasoning. Infi-MMR-3B achieves both state-of-the-art multimodal math reasoning ability (43.68% on MathVerse testmini, 27.04% on MathVision test, and 21.33% on OlympiadBench) and general reasoning ability (67.2% on MathVista testmini)."
Document-Level Text Generation with Minimum Bayes Risk Decoding using   Optimal Transport,Yuu Jinnai,2025-05-29T04:34:04Z,http://arxiv.org/pdf/2505.23078v1,"Document-level text generation tasks are known to be more difficult than sentence-level text generation tasks as they require the understanding of longer context to generate high-quality texts. In this paper, we investigate the adaption of Minimum Bayes Risk (MBR) decoding for document-level text generation tasks. MBR decoding makes use of a utility function to estimate the output with the highest expected utility from a set of candidate outputs. Although MBR decoding is shown to be effective in a wide range of sentence-level text generation tasks, its performance on document-level text generation tasks is limited as many of the utility functions are designed for evaluating the utility of sentences. To this end, we propose MBR-OT, a variant of MBR decoding using Wasserstein distance to compute the utility of a document using a sentence-level utility function. The experimental result shows that the performance of MBR-OT outperforms that of the standard MBR in document-level machine translation, text simplification, and dense image captioning tasks. Our code is available at https://github.com/jinnaiyuu/mbr-optimal-transport"
Contextualized Automatic Speech Recognition with Dynamic Vocabulary   Prediction and Activation,"Zhennan Lin, Kaixun Huang, Wei Ren, Linju Yang, Lei Xie",2025-05-29T04:31:33Z,http://arxiv.org/pdf/2505.23077v1,"Deep biasing improves automatic speech recognition (ASR) performance by incorporating contextual phrases. However, most existing methods enhance subwords in a contextual phrase as independent units, potentially compromising contextual phrase integrity, leading to accuracy reduction. In this paper, we propose an encoder-based phrase-level contextualized ASR method that leverages dynamic vocabulary prediction and activation. We introduce architectural optimizations and integrate a bias loss to extend phrase-level predictions based on frame-level outputs. We also introduce a confidence-activated decoding method that ensures the complete output of contextual phrases while suppressing incorrect bias. Experiments on Librispeech and Wenetspeech datasets demonstrate that our approach achieves relative WER reductions of 28.31% and 23.49% compared to baseline, with the WER on contextual phrases decreasing relatively by 72.04% and 75.69%."
SNS-Bench-VL: Benchmarking Multimodal Large Language Models in Social   Networking Services,"Hongcheng Guo, Zheyong Xie, Shaosheng Cao, Boyang Wang, Weiting Liu, Anjie Le, Lei Li, Zhoujun Li",2025-05-29T04:16:24Z,http://arxiv.org/pdf/2505.23065v1,"With the increasing integration of visual and textual content in Social Networking Services (SNS), evaluating the multimodal capabilities of Large Language Models (LLMs) is crucial for enhancing user experience, content understanding, and platform intelligence. Existing benchmarks primarily focus on text-centric tasks, lacking coverage of the multimodal contexts prevalent in modern SNS ecosystems. In this paper, we introduce SNS-Bench-VL, a comprehensive multimodal benchmark designed to assess the performance of Vision-Language LLMs in real-world social media scenarios. SNS-Bench-VL incorporates images and text across 8 multimodal tasks, including note comprehension, user engagement analysis, information retrieval, and personalized recommendation. It comprises 4,001 carefully curated multimodal question-answer pairs, covering single-choice, multiple-choice, and open-ended tasks. We evaluate over 25 state-of-the-art multimodal LLMs, analyzing their performance across tasks. Our findings highlight persistent challenges in multimodal social context comprehension. We hope SNS-Bench-VL will inspire future research towards robust, context-aware, and human-aligned multimodal intelligence for next-generation social networking services."
Self-Correcting Code Generation Using Small Language Models,"Jeonghun Cho, Deokhyung Kang, Hyounghun Kim, Gary Geunbae Lee",2025-05-29T04:04:44Z,http://arxiv.org/pdf/2505.23060v1,"Self-correction has demonstrated potential in code generation by allowing language models to revise and improve their outputs through successive refinement. Recent studies have explored prompting-based strategies that incorporate verification or feedback loops using proprietary models, as well as training-based methods that leverage their strong reasoning capabilities. However, whether smaller models possess the capacity to effectively guide their outputs through self-reflection remains unexplored. Our findings reveal that smaller models struggle to exhibit reflective revision behavior across both self-correction paradigms. In response, we introduce CoCoS, an approach designed to enhance the ability of small language models for multi-turn code correction. Specifically, we propose an online reinforcement learning objective that trains the model to confidently maintain correct outputs while progressively correcting incorrect outputs as turns proceed. Our approach features an accumulated reward function that aggregates rewards across the entire trajectory and a fine-grained reward better suited to multi-turn correction scenarios. This facilitates the model in enhancing initial response quality while achieving substantial improvements through self-correction. With 1B-scale models, CoCoS achieves improvements of 35.8% on the MBPP and 27.7% on HumanEval compared to the baselines."
Be.FM: Open Foundation Models for Human Behavior,"Yutong Xie, Zhuoheng Li, Xiyuan Wang, Yijun Pan, Qijia Liu, Xingzhi Cui, Kuang-Yu Lo, Ruoyi Gao, Xingjian Zhang, Jin Huang, Walter Yuan, Matthew O. Jackson, Qiaozhu Mei",2025-05-29T04:03:51Z,http://arxiv.org/pdf/2505.23058v1,"Despite their success in numerous fields, the potential of foundation models for modeling and understanding human behavior remains largely unexplored. We introduce Be.FM, one of the first open foundation models designed for human behavior modeling. Built upon open-source large language models and fine-tuned on a diverse range of behavioral data, Be.FM can be used to understand and predict human decision-making. We construct a comprehensive set of benchmark tasks for testing the capabilities of behavioral foundation models. Our results demonstrate that Be.FM can predict behaviors, infer characteristics of individuals and populations, generate insights about contexts, and apply behavioral science knowledge."
Query Routing for Retrieval-Augmented Language Models,"Jiarui Zhang, Xiangyu Liu, Yong Hu, Chaoyue Niu, Fan Wu, Guihai Chen",2025-05-29T03:44:56Z,http://arxiv.org/pdf/2505.23052v1,"Retrieval-Augmented Generation (RAG) significantly improves the performance of Large Language Models (LLMs) on knowledge-intensive tasks. However, varying response quality across LLMs under RAG necessitates intelligent routing mechanisms, which select the most suitable model for each query from multiple retrieval-augmented LLMs via a dedicated router model. We observe that external documents dynamically affect LLMs' ability to answer queries, while existing routing methods, which rely on static parametric knowledge representations, exhibit suboptimal performance in RAG scenarios. To address this, we formally define the new retrieval-augmented LLM routing problem, incorporating the influence of retrieved documents into the routing framework. We propose RAGRouter, a RAG-aware routing design, which leverages document embeddings and RAG capability embeddings with contrastive learning to capture knowledge representation shifts and enable informed routing decisions. Extensive experiments on diverse knowledge-intensive tasks and retrieval settings show that RAGRouter outperforms the best individual LLM by 3.61% on average and existing routing methods by 3.29%-9.33%. With an extended score-threshold-based mechanism, it also achieves strong performance-efficiency trade-offs under low-latency constraints."
DenoiseRotator: Enhance Pruning Robustness for LLMs via Importance   Concentration,"Tianteng Gu, Bei Liu, Bo Xiao, Ke Zeng, Jiacheng Liu, Yanmin Qian",2025-05-29T03:44:09Z,http://arxiv.org/pdf/2505.23049v1,"Pruning is a widely used technique to compress large language models (LLMs) by removing unimportant weights, but it often suffers from significant performance degradation - especially under semi-structured sparsity constraints. Existing pruning methods primarily focus on estimating the importance of individual weights, which limits their ability to preserve critical capabilities of the model. In this work, we propose a new perspective: rather than merely selecting which weights to prune, we first redistribute parameter importance to make the model inherently more amenable to pruning. By minimizing the information entropy of normalized importance scores, our approach concentrates importance onto a smaller subset of weights, thereby enhancing pruning robustness. We instantiate this idea through DenoiseRotator, which applies learnable orthogonal transformations to the model's weight matrices. Our method is model-agnostic and can be seamlessly integrated with existing pruning techniques such as Magnitude, SparseGPT, and Wanda. Evaluated on LLaMA3, Qwen2.5, and Mistral models under 50% unstructured and 2:4 semi-structured sparsity, DenoiseRotator consistently improves perplexity and zero-shot accuracy. For instance, on LLaMA3-70B pruned with SparseGPT at 2:4 semi-structured sparsity, DenoiseRotator reduces the perplexity gap to the dense model by 58%, narrowing the degradation from 8.1 to 3.4 points. Codes are available at https://github.com/Axel-gu/DenoiseRotator."
TailorSQL: An NL2SQL System Tailored to Your Query Workload,"Kapil Vaidya, Jialin Ding, Sebastian Kosak, David Kernert, Chuan Lei, Xiao Qin, Abhinav Tripathy, Ramesh Balan, Balakrishnan Narayanaswamy, Tim Kraska",2025-05-29T03:27:22Z,http://arxiv.org/pdf/2505.23039v1,"NL2SQL (natural language to SQL) translates natural language questions into SQL queries, thereby making structured data accessible to non-technical users, serving as the foundation for intelligent data applications. State-of-the-art NL2SQL techniques typically perform translation by retrieving database-specific information, such as the database schema, and invoking a pre-trained large language model (LLM) using the question and retrieved information to generate the SQL query.   However, existing NL2SQL techniques miss a key opportunity which is present in real-world settings: NL2SQL is typically applied on existing databases which have already served many SQL queries in the past. The past query workload implicitly contains information which is helpful for accurate NL2SQL translation and is not apparent from the database schema alone, such as common join paths and the semantics of obscurely-named tables and columns. We introduce TailorSQL, a NL2SQL system that takes advantage of information in the past query workload to improve both the accuracy and latency of translating natural language questions into SQL. By specializing to a given workload, TailorSQL achieves up to 2$\times$ improvement in execution accuracy on standardized benchmarks."
EL4NER: Ensemble Learning for Named Entity Recognition via Multiple   Small-Parameter Large Language Models,"Yuzhen Xiao, Jiahe Song, Yongxin Xu, Ruizhe Zhang, Yiqi Xiao, Xin Lu, Runchuan Zhu, Bowen Jiang, Junfeng Zhao",2025-05-29T03:25:14Z,http://arxiv.org/pdf/2505.23038v1,"In-Context Learning (ICL) technique based on Large Language Models (LLMs) has gained prominence in Named Entity Recognition (NER) tasks for its lower computing resource consumption, less manual labeling overhead, and stronger generalizability. Nevertheless, most ICL-based NER methods depend on large-parameter LLMs: the open-source models demand substantial computational resources for deployment and inference, while the closed-source ones incur high API costs, raise data-privacy concerns, and hinder community collaboration. To address this question, we propose an Ensemble Learning Method for Named Entity Recognition (EL4NER), which aims at aggregating the ICL outputs of multiple open-source, small-parameter LLMs to enhance overall performance in NER tasks at less deployment and inference cost. Specifically, our method comprises three key components. First, we design a task decomposition-based pipeline that facilitates deep, multi-stage ensemble learning. Second, we introduce a novel span-level sentence similarity algorithm to establish an ICL demonstration retrieval mechanism better suited for NER tasks. Third, we incorporate a self-validation mechanism to mitigate the noise introduced during the ensemble process. We evaluated EL4NER on multiple widely adopted NER datasets from diverse domains. Our experimental results indicate that EL4NER surpasses most closed-source, large-parameter LLM-based methods at a lower parameter cost and even attains state-of-the-art (SOTA) performance among ICL-based methods on certain datasets. These results show the parameter efficiency of EL4NER and underscore the feasibility of employing open-source, small-parameter LLMs within the ICL paradigm for NER tasks."
Improving Multilingual Social Media Insights: Aspect-based Comment   Analysis,"Longyin Zhang, Bowei Zou, Ai Ti Aw",2025-05-29T03:24:39Z,http://arxiv.org/pdf/2505.23037v1,"The inherent nature of social media posts, characterized by the freedom of language use with a disjointed array of diverse opinions and topics, poses significant challenges to downstream NLP tasks such as comment clustering, comment summarization, and social media opinion analysis. To address this, we propose a granular level of identifying and generating aspect terms from individual comments to guide model attention. Specifically, we leverage multilingual large language models with supervised fine-tuning for comment aspect term generation (CAT-G), further aligning the model's predictions with human expectations through DPO. We demonstrate the effectiveness of our method in enhancing the comprehension of social media discourse on two NLP tasks. Moreover, this paper contributes the first multilingual CAT-G test set on English, Chinese, Malay, and Bahasa Indonesian. As LLM capabilities vary among languages, this test set allows for a comparative analysis of performance across languages with varying levels of LLM proficiency."
