title,authors,published,pdf_url,abstract
Mixed-R1: Unified Reward Perspective For Reasoning Capability in   Multimodal Large Language Models,"Shilin Xu, Yanwei Li, Rui Yang, Tao Zhang, Yueyi Sun, Wei Chow, Linfeng Li, Hang Song, Qi Xu, Yunhai Tong, Xiangtai Li, Hao Fei",2025-05-30T03:11:46Z,http://arxiv.org/pdf/2505.24164v1,"Recent works on large language models (LLMs) have successfully demonstrated the emergence of reasoning capabilities via reinforcement learning (RL). Although recent efforts leverage group relative policy optimization (GRPO) for MLLMs post-training, they constantly explore one specific aspect, such as grounding tasks, math problems, or chart analysis. There are no works that can leverage multi-source MLLM tasks for stable reinforcement learning. In this work, we present a unified perspective to solve this problem. We present Mixed-R1, a unified yet straightforward framework that contains a mixed reward function design (Mixed-Reward) and a mixed post-training dataset (Mixed-45K). We first design a data engine to select high-quality examples to build the Mixed-45K post-training dataset. Then, we present a Mixed-Reward design, which contains various reward functions for various MLLM tasks. In particular, it has four different reward functions: matching reward for binary answer or multiple-choice problems, chart reward for chart-aware datasets, IoU reward for grounding problems, and open-ended reward for long-form text responses such as caption datasets. To handle the various long-form text content, we propose a new open-ended reward named Bidirectional Max-Average Similarity (BMAS) by leveraging tokenizer embedding matching between the generated response and the ground truth. Extensive experiments show the effectiveness of our proposed method on various MLLMs, including Qwen2.5-VL and Intern-VL on various sizes. Our dataset and model are available at https://github.com/xushilin1/mixed-r1."
LKD-KGC: Domain-Specific KG Construction via LLM-driven Knowledge   Dependency Parsing,"Jiaqi Sun, Shiyou Qian, Zhangchi Han, Wei Li, Zelin Qian, Dingyu Yang, Jian Cao, Guangtao Xue",2025-05-30T03:10:23Z,http://arxiv.org/pdf/2505.24163v1,"Knowledge Graphs (KGs) structure real-world entities and their relationships into triples, enhancing machine reasoning for various tasks. While domain-specific KGs offer substantial benefits, their manual construction is often inefficient and requires specialized knowledge. Recent approaches for knowledge graph construction (KGC) based on large language models (LLMs), such as schema-guided KGC and reference knowledge integration, have proven efficient. However, these methods are constrained by their reliance on manually defined schema, single-document processing, and public-domain references, making them less effective for domain-specific corpora that exhibit complex knowledge dependencies and specificity, as well as limited reference knowledge. To address these challenges, we propose LKD-KGC, a novel framework for unsupervised domain-specific KG construction. LKD-KGC autonomously analyzes document repositories to infer knowledge dependencies, determines optimal processing sequences via LLM driven prioritization, and autoregressively generates entity schema by integrating hierarchical inter-document contexts. This schema guides the unsupervised extraction of entities and relationships, eliminating reliance on predefined structures or external knowledge. Extensive experiments show that compared with state-of-the-art baselines, LKD-KGC generally achieves improvements of 10% to 20% in both precision and recall rate, demonstrating its potential in constructing high-quality domain-specific KGs."
Rationales Are Not Silver Bullets: Measuring the Impact of Rationales on   Model Performance and Reliability,"Chiwei Zhu, Benfeng Xu, An Yang, Junyang Lin, Quan Wang, Chang Zhou, Zhendong Mao",2025-05-30T02:39:37Z,http://arxiv.org/pdf/2505.24147v1,"Training language models with rationales augmentation has been shown to be beneficial in many existing works. In this paper, we identify that such a prevailing view does not hold consistently. We conduct comprehensive investigations to thoroughly inspect the impact of rationales on model performance as well as a novel perspective of model reliability. The results lead to several key findings that add new insights upon existing understandings: 1) Rationales can, at times, deteriorate model performance; 2) Rationales can, at times, improve model reliability, even outperforming their untrained counterparts; 3) A linear correspondence exists in between the performance and reliability improvements, while both are driven by the intrinsic difficulty of the task. These findings provide informative regulations on the broad utilization of rationales and raise critical implications on the procedure of explicitly aligning language models with implicit human thoughts. Codes can be found at https://github.com/Ignoramus0817/rationales."
CrossICL: Cross-Task In-Context Learning via Unsupervised Demonstration   Transfer,"Jinglong Gao, Xiao Ding, Lingxiao Zou, Bing Qin, Ting Liu",2025-05-30T02:26:05Z,http://arxiv.org/pdf/2505.24143v1,"In-Context Learning (ICL) enhances the performance of large language models (LLMs) with demonstrations. However, obtaining these demonstrations primarily relies on manual effort. In most real-world scenarios, users are often unwilling or unable to provide such demonstrations. Inspired by the human analogy, we explore a new ICL paradigm CrossICL to study how to utilize existing source task demonstrations in the ICL for target tasks, thereby obtaining reliable guidance without any additional manual effort. To explore this, we first design a two-stage alignment strategy to mitigate the interference caused by gaps across tasks, as the foundation for our experimental exploration. Based on it, we conduct comprehensive exploration of CrossICL, with 875 NLP tasks from the Super-NI benchmark and six types of LLMs, including GPT-4o. Experimental results demonstrate the effectiveness of CrossICL and provide valuable insights on questions like the criteria for selecting cross-task demonstrations, as well as the types of task-gap-induced interference in CrossICL."
R-KV: Redundancy-aware KV Cache Compression for Training-Free Reasoning   Models Acceleration,"Zefan Cai, Wen Xiao, Hanshi Sun, Cheng Luo, Yikai Zhang, Ke Wan, Yucheng Li, Yeyang Zhou, Li-Wen Chang, Jiuxiang Gu, Zhen Dong, Anima Anandkumar, Abedelkadir Asi, Junjie Hu",2025-05-30T02:03:24Z,http://arxiv.org/pdf/2505.24133v1,"Reasoning models have demonstrated impressive performance in self-reflection and chain-of-thought reasoning. However, they often produce excessively long outputs, leading to prohibitively large key-value (KV) caches during inference. While chain-of-thought inference significantly improves performance on complex reasoning tasks, it can also lead to reasoning failures when deployed with existing KV cache compression approaches. To address this, we propose Redundancy-aware KV Cache Compression for Reasoning models (R-KV), a novel method specifically targeting redundant tokens in reasoning models. Our method preserves nearly 100% of the full KV cache performance using only 10% of the KV cache, substantially outperforming existing KV cache baselines, which reach only 60% of the performance. Remarkably, R-KV even achieves 105% of full KV cache performance with 16% of the KV cache. This KV-cache reduction also leads to a 90% memory saving and a 6.6X throughput over standard chain-of-thought reasoning inference. Experimental results show that R-KV consistently outperforms existing KV cache compression baselines across two mathematical reasoning datasets."
The State of Multilingual LLM Safety Research: From Measuring the   Language Gap to Mitigating It,"Zheng-Xin Yong, Beyza Ermis, Marzieh Fadaee, Stephen H. Bach, Julia Kreutzer",2025-05-30T01:32:44Z,http://arxiv.org/pdf/2505.24119v1,"This paper presents a comprehensive analysis of the linguistic diversity of LLM safety research, highlighting the English-centric nature of the field. Through a systematic review of nearly 300 publications from 2020--2024 across major NLP conferences and workshops at *ACL, we identify a significant and growing language gap in LLM safety research, with even high-resource non-English languages receiving minimal attention. We further observe that non-English languages are rarely studied as a standalone language and that English safety research exhibits poor language documentation practice. To motivate future research into multilingual safety, we make several recommendations based on our survey, and we then pose three concrete future directions on safety evaluation, training data generation, and crosslingual safety generalization. Based on our survey and proposed directions, the field can develop more robust, inclusive AI safety practices for diverse global populations."
Training LLMs for EHR-Based Reasoning Tasks via Reinforcement Learning,"Jiacheng Lin, Zhenbang Wu, Jimeng Sun",2025-05-30T01:13:22Z,http://arxiv.org/pdf/2505.24105v1,"We present EHRMIND, a practical recipe for adapting large language models (LLMs) to complex clinical reasoning tasks using reinforcement learning with verifiable rewards (RLVR). While RLVR has succeeded in mathematics and coding, its application to healthcare contexts presents unique challenges due to the specialized knowledge and reasoning required for electronic health record (EHR) interpretation. Our pilot study on the MEDCALC benchmark reveals two key failure modes: (1) misapplied knowledge, where models possess relevant medical knowledge but apply it incorrectly, and (2) missing knowledge, where models lack essential domain knowledge. To address these cases, EHRMIND applies a two-stage solution: a lightweight supervised fine-tuning (SFT) warm-up that injects missing domain knowledge, stabilizes subsequent training, and encourages structured, interpretable outputs; followed by RLVR, which reinforces outcome correctness and refines the model's decision-making. We demonstrate the effectiveness of our method across diverse clinical applications, including medical calculations (MEDCALC), patient-trial matching (TREC CLINICAL TRIALS), and disease diagnosis (EHRSHOT). EHRMIND delivers consistent gains in accuracy, interpretability, and cross-task generalization. These findings offer practical guidance for applying RLVR to enhance LLM capabilities in healthcare settings."
HardTests: Synthesizing High-Quality Test Cases for LLM Coding,"Zhongmou He, Yee Man Choi, Kexun Zhang, Jiabao Ji, Junting Zhou, Dejia Xu, Ivan Bercovich, Aidan Zhang, Lei Li",2025-05-30T01:00:34Z,http://arxiv.org/pdf/2505.24098v1,"Verifiers play a crucial role in large language model (LLM) reasoning, needed by post-training techniques such as reinforcement learning. However, reliable verifiers are hard to get for difficult coding problems, because a well-disguised wrong solution may only be detected by carefully human-written edge cases that are difficult to synthesize. To address this issue, we propose HARDTESTGEN, a pipeline for high-quality test synthesis using LLMs. With this pipeline, we curate a comprehensive competitive programming dataset HARDTESTS with 47k problems and synthetic high-quality tests. Compared with existing tests, HARDTESTGEN tests demonstrate precision that is 11.3 percentage points higher and recall that is 17.5 percentage points higher when evaluating LLM-generated code. For harder problems, the improvement in precision can be as large as 40 points. HARDTESTS also proves to be more effective for model training, measured by downstream code generation performance. We will open-source our dataset and synthesis pipeline at https://leililab.github.io/HardTests/."
TCM-Ladder: A Benchmark for Multimodal Question Answering on Traditional   Chinese Medicine,"Jiacheng Xie, Yang Yu, Ziyang Zhang, Shuai Zeng, Jiaxuan He, Ayush Vasireddy, Xiaoting Tang, Congyu Guo, Lening Zhao, Congcong Jing, Guanghui An, Dong Xu",2025-05-29T23:13:57Z,http://arxiv.org/pdf/2505.24063v1,"Traditional Chinese Medicine (TCM), as an effective alternative medicine, has been receiving increasing attention. In recent years, the rapid development of large language models (LLMs) tailored for TCM has underscored the need for an objective and comprehensive evaluation framework to assess their performance on real-world tasks. However, existing evaluation datasets are limited in scope and primarily text-based, lacking a unified and standardized multimodal question-answering (QA) benchmark. To address this issue, we introduce TCM-Ladder, the first multimodal QA dataset specifically designed for evaluating large TCM language models. The dataset spans multiple core disciplines of TCM, including fundamental theory, diagnostics, herbal formulas, internal medicine, surgery, pharmacognosy, and pediatrics. In addition to textual content, TCM-Ladder incorporates various modalities such as images and videos. The datasets were constructed using a combination of automated and manual filtering processes and comprise 52,000+ questions in total. These questions include single-choice, multiple-choice, fill-in-the-blank, diagnostic dialogue, and visual comprehension tasks. We trained a reasoning model on TCM-Ladder and conducted comparative experiments against 9 state-of-the-art general domain and 5 leading TCM-specific LLMs to evaluate their performance on the datasets. Moreover, we propose Ladder-Score, an evaluation method specifically designed for TCM question answering that effectively assesses answer quality regarding terminology usage and semantic expression. To our knowledge, this is the first work to evaluate mainstream general domain and TCM-specific LLMs on a unified multimodal benchmark. The datasets and leaderboard are publicly available at https://tcmladder.com or https://54.211.107.106 and will be continuously updated."
MedPAIR: Measuring Physicians and AI Relevance Alignment in Medical   Question Answering,"Yuexing Hao, Kumail Alhamoud, Hyewon Jeong, Haoran Zhang, Isha Puri, Philip Torr, Mike Schaekermann, Ariel D. Stern, Marzyeh Ghassemi",2025-05-29T22:23:48Z,http://arxiv.org/pdf/2505.24040v1,"Large Language Models (LLMs) have demonstrated remarkable performance on various medical question-answering (QA) benchmarks, including standardized medical exams. However, correct answers alone do not ensure correct logic, and models may reach accurate conclusions through flawed processes. In this study, we introduce the MedPAIR (Medical Dataset Comparing Physicians and AI Relevance Estimation and Question Answering) dataset to evaluate how physician trainees and LLMs prioritize relevant information when answering QA questions. We obtain annotations on 1,300 QA pairs from 36 physician trainees, labeling each sentence within the question components for relevance. We compare these relevance estimates to those for LLMs, and further evaluate the impact of these ""relevant"" subsets on downstream task performance for both physician trainees and LLMs. We find that LLMs are frequently not aligned with the content relevance estimates of physician trainees. After filtering out physician trainee-labeled irrelevant sentences, accuracy improves for both the trainees and the LLMs. All LLM and physician trainee-labeled data are available at: http://medpair.csail.mit.edu/."
The Surprising Soupability of Documents in State Space Models,"Yasaman Jafari, Zixian Wang, Leon Bergen, Taylor Berg-Kirkpatrick",2025-05-29T22:13:21Z,http://arxiv.org/pdf/2505.24033v1,"We investigate whether hidden states from Structured State Space Models (SSMs) can be merged post-hoc to support downstream reasoning. Inspired by model souping, we propose a strategy where documents are encoded independently and their representations are pooled -- via simple operations like averaging -- into a single context state. This approach, which we call document souping, enables modular encoding and reuse without reprocessing the full input for each query. We finetune Mamba2 models to produce soupable representations and find that they support multi-hop QA, sparse retrieval, and long-document reasoning with strong accuracy. On HotpotQA, souping ten independently encoded documents nearly matches the performance of a cross-encoder trained on the same inputs."
Hidden Persuasion: Detecting Manipulative Narratives on Social Media   During the 2022 Russian Invasion of Ukraine,"Kateryna Akhynko, Oleksandr Kosovan, Mykola Trokhymovych",2025-05-29T22:01:42Z,http://arxiv.org/pdf/2505.24028v1,"This paper presents one of the top-performing solutions to the UNLP 2025 Shared Task on Detecting Manipulation in Social Media. The task focuses on detecting and classifying rhetorical and stylistic manipulation techniques used to influence Ukrainian Telegram users. For the classification subtask, we fine-tuned the Gemma 2 language model with LoRA adapters and applied a second-level classifier leveraging meta-features and threshold optimization. For span detection, we employed an XLM-RoBERTa model trained for multi-target, including token binary classification. Our approach achieved 2nd place in classification and 3rd place in span detection."
BeaverTalk: Oregon State University's IWSLT 2025 Simultaneous Speech   Translation System,"Matthew Raffel, Victor Agostinelli, Lizhong Chen",2025-05-29T21:34:49Z,http://arxiv.org/pdf/2505.24016v1,"This paper discusses the construction, fine-tuning, and deployment of BeaverTalk, a cascaded system for speech-to-text translation as part of the IWSLT 2025 simultaneous translation task. The system architecture employs a VAD segmenter for breaking a speech stream into segments, Whisper Large V2 for automatic speech recognition (ASR), and Gemma 3 12B for simultaneous translation. Regarding the simultaneous translation LLM, it is fine-tuned via low-rank adaptors (LoRAs) for a conversational prompting strategy that leverages a single prior-sentence memory bank from the source language as context. The cascaded system participated in the English$\rightarrow$German and English$\rightarrow$Chinese language directions for both the low and high latency regimes. In particular, on the English$\rightarrow$German task, the system achieves a BLEU of 24.64 and 27.83 at a StreamLAAL of 1837.86 and 3343.73, respectively. Then, on the English$\rightarrow$Chinese task, the system achieves a BLEU of 34.07 and 37.23 at a StreamLAAL of 2216.99 and 3521.35, respectively."
Large Language Model Meets Constraint Propagation,"Alexandre Bonlarron, Florian Régin, Elisabetta De Maria, Jean-Charles Régin",2025-05-29T21:18:12Z,http://arxiv.org/pdf/2505.24012v1,"Large Language Models (LLMs) excel at generating fluent text but struggle to enforce external constraints because they generate tokens sequentially without explicit control mechanisms. GenCP addresses this limitation by combining LLM predictions with Constraint Programming (CP) reasoning, formulating text generation as a Constraint Satisfaction Problem (CSP). In this paper, we improve GenCP by integrating Masked Language Models (MLMs) for domain generation, which allows bidirectional constraint propagation that leverages both past and future tokens. This integration bridges the gap between token-level prediction and structured constraint enforcement, leading to more reliable and constraint-aware text generation. Our evaluation on COLLIE benchmarks demonstrates that incorporating domain preview via MLM calls significantly improves GenCP's performance. Although this approach incurs additional MLM calls and, in some cases, increased backtracking, the overall effect is a more efficient use of LLM inferences and an enhanced ability to generate feasible and meaningful solutions, particularly in tasks with strict content constraints."
Diversity of Transformer Layers: One Aspect of Parameter Scaling Laws,"Hidetaka Kamigaito, Ying Zhang, Jingun Kwon, Katsuhiko Hayashi, Manabu Okumura, Taro Watanabe",2025-05-29T21:13:31Z,http://arxiv.org/pdf/2505.24009v1,"Transformers deliver outstanding performance across a wide range of tasks and are now a dominant backbone architecture for large language models (LLMs). Their task-solving performance is improved by increasing parameter size, as shown in the recent studies on parameter scaling laws. Although recent mechanistic-interpretability studies have deepened our understanding of the internal behavior of Transformers by analyzing their residual stream, the relationship between these internal mechanisms and the parameter scaling laws remains unclear. To bridge this gap, we focus on layers and their size, which mainly decide the parameter size of Transformers. For this purpose, we first theoretically investigate the layers within the residual stream through a bias-diversity decomposition. The decomposition separates (i) bias, the error of each layer's output from the ground truth, and (ii) diversity, which indicates how much the outputs of each layer differ from each other. Analyzing Transformers under this theory reveals that performance improves when individual layers make predictions close to the correct answer and remain mutually diverse. We show that diversity becomes especially critical when individual layers' outputs are far from the ground truth. Finally, we introduce an information-theoretic diversity and show our main findings that adding layers enhances performance only when those layers behave differently, i.e., are diverse. We also reveal the performance gains from increasing the number of layers exhibit submodularity: marginal improvements diminish as additional layers increase, mirroring the logarithmic convergence predicted by the parameter scaling laws. Experiments on multiple semantic-understanding tasks with various LLMs empirically confirm the theoretical properties derived in this study."
Redefining Research Crowdsourcing: Incorporating Human Feedback with   LLM-Powered Digital Twins,"Amanda Chan, Catherine Di, Joseph Rupertus, Gary Smith, Varun Nagaraj Rao, Manoel Horta Ribeiro, Andrés Monroy-Hernández",2025-05-29T20:55:27Z,http://arxiv.org/pdf/2505.24004v1,"Crowd work platforms like Amazon Mechanical Turk and Prolific are vital for research, yet workers' growing use of generative AI tools poses challenges. Researchers face compromised data validity as AI responses replace authentic human behavior, while workers risk diminished roles as AI automates tasks. To address this, we propose a hybrid framework using digital twins, personalized AI models that emulate workers' behaviors and preferences while keeping humans in the loop. We evaluate our system with an experiment (n=88 crowd workers) and in-depth interviews with crowd workers (n=5) and social science researchers (n=4). Our results suggest that digital twins may enhance productivity and reduce decision fatigue while maintaining response quality. Both researchers and workers emphasized the importance of transparency, ethical data use, and worker agency. By automating repetitive tasks and preserving human engagement for nuanced ones, digital twins may help balance scalability with authenticity."
Is Your Model Fairly Certain? Uncertainty-Aware Fairness Evaluation for   LLMs,"Yinong Oliver Wang, Nivedha Sivakumar, Falaah Arif Khan, Rin Metcalf Susa, Adam Golinski, Natalie Mackraz, Barry-John Theobald, Luca Zappella, Nicholas Apostoloff",2025-05-29T20:45:18Z,http://arxiv.org/pdf/2505.23996v1,"The recent rapid adoption of large language models (LLMs) highlights the critical need for benchmarking their fairness. Conventional fairness metrics, which focus on discrete accuracy-based evaluations (i.e., prediction correctness), fail to capture the implicit impact of model uncertainty (e.g., higher model confidence about one group over another despite similar accuracy). To address this limitation, we propose an uncertainty-aware fairness metric, UCerF, to enable a fine-grained evaluation of model fairness that is more reflective of the internal bias in model decisions compared to conventional fairness measures. Furthermore, observing data size, diversity, and clarity issues in current datasets, we introduce a new gender-occupation fairness evaluation dataset with 31,756 samples for co-reference resolution, offering a more diverse and suitable dataset for evaluating modern LLMs. We establish a benchmark, using our metric and dataset, and apply it to evaluate the behavior of ten open-source LLMs. For example, Mistral-7B exhibits suboptimal fairness due to high confidence in incorrect predictions, a detail overlooked by Equalized Odds but captured by UCerF. Overall, our proposed LLM benchmark, which evaluates fairness with uncertainty awareness, paves the way for developing more transparent and accountable AI systems."
