title,authors,published,pdf_url,abstract
Say What You Mean: Natural Language Access Control with Large Language   Models for Internet of Things,"Ye Cheng, Minghui Xu, Yue Zhang, Kun Li, Hao Wu, Yechao Zhang, Shaoyong Guo, Wangjie Qiu, Dongxiao Yu, Xiuzhen Cheng",2025-05-28T10:59:00Z,http://arxiv.org/pdf/2505.23835v1,"Access control in the Internet of Things (IoT) is becoming increasingly complex, as policies must account for dynamic and contextual factors such as time, location, user behavior, and environmental conditions. However, existing platforms either offer only coarse-grained controls or rely on rigid rule matching, making them ill-suited for semantically rich or ambiguous access scenarios. Moreover, the policy authoring process remains fragmented: domain experts describe requirements in natural language, but developers must manually translate them into code, introducing semantic gaps and potential misconfiguration. In this work, we present LACE, the Language-based Access Control Engine, a hybrid framework that leverages large language models (LLMs) to bridge the gap between human intent and machine-enforceable logic. LACE combines prompt-guided policy generation, retrieval-augmented reasoning, and formal validation to support expressive, interpretable, and verifiable access control. It enables users to specify policies in natural language, automatically translates them into structured rules, validates semantic correctness, and makes access decisions using a hybrid LLM-rule-based engine. We evaluate LACE in smart home environments through extensive experiments. LACE achieves 100% correctness in verified policy generation and up to 88% decision accuracy with 0.79 F1-score using DeepSeek-V3, outperforming baselines such as GPT-3.5 and Gemini. The system also demonstrates strong scalability under increasing policy volume and request concurrency. Our results highlight LACE's potential to enable secure, flexible, and user-friendly access control across real-world IoT platforms."
Look & Mark: Leveraging Radiologist Eye Fixations and Bounding boxes in   Multimodal Large Language Models for Chest X-ray Report Generation,"Yunsoo Kim, Jinge Wu, Su-Hwan Kim, Pardeep Vasudev, Jiashu Shen, Honghan Wu",2025-05-28T10:54:40Z,http://arxiv.org/pdf/2505.22222v1,"Recent advancements in multimodal Large Language Models (LLMs) have significantly enhanced the automation of medical image analysis, particularly in generating radiology reports from chest X-rays (CXR). However, these models still suffer from hallucinations and clinically significant errors, limiting their reliability in real-world applications. In this study, we propose Look & Mark (L&M), a novel grounding fixation strategy that integrates radiologist eye fixations (Look) and bounding box annotations (Mark) into the LLM prompting framework. Unlike conventional fine-tuning, L&M leverages in-context learning to achieve substantial performance gains without retraining. When evaluated across multiple domain-specific and general-purpose models, L&M demonstrates significant gains, including a 1.2% improvement in overall metrics (A.AVG) for CXR-LLaVA compared to baseline prompting and a remarkable 9.2% boost for LLaVA-Med. General-purpose models also benefit from L&M combined with in-context learning, with LLaVA-OV achieving an 87.3% clinical average performance (C.AVG)-the highest among all models, even surpassing those explicitly trained for CXR report generation. Expert evaluations further confirm that L&M reduces clinically significant errors (by 0.43 average errors per report), such as false predictions and omissions, enhancing both accuracy and reliability. These findings highlight L&M's potential as a scalable and efficient solution for AI-assisted radiology, paving the way for improved diagnostic workflows in low-resource clinical settings."
Pitfalls of Rule- and Model-based Verifiers -- A Case Study on   Mathematical Reasoning,"Yuzhen Huang, Weihao Zeng, Xingshan Zeng, Qi Zhu, Junxian He",2025-05-28T10:28:41Z,http://arxiv.org/pdf/2505.22203v1,"Trustworthy verifiers are essential for the success of reinforcement learning with verifiable reward (RLVR), which is the core methodology behind various large reasoning models such as DeepSeek-R1. In complex domains like mathematical reasoning, rule-based verifiers have been widely adopted in previous works to train strong reasoning models. However, the reliability of these verifiers and their impact on the RL training process remain poorly understood. In this work, we take mathematical reasoning as a case study and conduct a comprehensive analysis of various verifiers in both static evaluation and RL training scenarios. First, we find that current open-source rule-based verifiers often fail to recognize equivalent answers presented in different formats across multiple commonly used mathematical datasets, resulting in non-negligible false negative rates. This limitation adversely affects RL training performance and becomes more pronounced as the policy model gets stronger. Subsequently, we investigate model-based verifiers as a potential solution to address these limitations. While the static evaluation shows that model-based verifiers achieve significantly higher verification accuracy, further analysis and RL training results imply that they are highly susceptible to hacking, where they misclassify certain patterns in responses as correct (i.e., false positives). This vulnerability is exploited during policy model optimization, leading to artificially inflated rewards. Our findings underscore the unique risks inherent to both rule-based and model-based verifiers, aiming to offer valuable insights to develop more robust reward systems in reinforcement learning."
Let's Predict Sentence by Sentence,"Hyeonbin Hwang, Byeongguk Jeon, Seungone Kim, Jiyeon Kim, Hoyeon Chang, Sohee Yang, Seungpil Won, Dohaeng Lee, Youbin Ahn, Minjoon Seo",2025-05-28T10:28:35Z,http://arxiv.org/pdf/2505.22202v1,"Autoregressive language models (LMs) generate one token at a time, yet human reasoning operates over higher-level abstractions - sentences, propositions, and concepts. This contrast raises a central question- Can LMs likewise learn to reason over structured semantic units rather than raw token sequences? In this work, we investigate whether pretrained LMs can be lifted into such abstract reasoning spaces by building on their learned representations. We present a framework that adapts a pretrained token-level LM to operate in sentence space by autoregressively predicting continuous embeddings of next sentences. We explore two embedding paradigms inspired by classical representation learning: 1) semantic embeddings, learned via autoencoding to preserve surface meaning; and 2) contextual embeddings, trained via next-sentence prediction to encode anticipatory structure. We evaluate both under two inference regimes: Discretized, which decodes each predicted embedding into text before re-encoding; and Continuous, which reasons entirely in embedding space for improved efficiency. Across four domains - mathematics, logic, commonsense, and planning - contextual embeddings under continuous inference show competitive performance with Chain-of-Thought (CoT) while reducing inference-time FLOPs on average by half. We also present early signs of scalability and modular adaptation. Finally, to visualize latent trajectories, we introduce SentenceLens, a diagnostic tool that decodes intermediate model states into interpretable sentences. Together, our results indicate that pretrained LMs can effectively transition to abstract, structured reasoning within latent embedding spaces."
Breaking the Cloak! Unveiling Chinese Cloaked Toxicity with Homophone   Graph and Toxic Lexicon,"Xuchen Ma, Jianxiang Yu, Wenming Shao, Bo Pang, Xiang Li",2025-05-28T09:58:15Z,http://arxiv.org/pdf/2505.22184v1,"Social media platforms have experienced a significant rise in toxic content, including abusive language and discriminatory remarks, presenting growing challenges for content moderation. Some users evade censorship by deliberately disguising toxic words through homophonic cloak, which necessitates the task of unveiling cloaked toxicity. Existing methods are mostly designed for English texts, while Chinese cloaked toxicity unveiling has not been solved yet. To tackle the issue, we propose C$^2$TU, a novel training-free and prompt-free method for Chinese cloaked toxic content unveiling. It first employs substring matching to identify candidate toxic words based on Chinese homo-graph and toxic lexicon. Then it filters those candidates that are non-toxic and corrects cloaks to be their corresponding toxicities. Specifically, we develop two model variants for filtering, which are based on BERT and LLMs, respectively. For LLMs, we address the auto-regressive limitation in computing word occurrence probability and utilize the full semantic contexts of a text sequence to reveal cloaked toxic words. Extensive experiments demonstrate that C$^2$TU can achieve superior performance on two Chinese toxic datasets. In particular, our method outperforms the best competitor by up to 71% on the F1 score and 35% on accuracy, respectively."
Speculative Decoding Meets Quantization: Compatibility Evaluation and   Hierarchical Framework Design,"Yudi Zhang, Weilin Zhao, Xu Han, Tiejun Zhao, Wang Xu, Hailong Cao, Conghui Zhu",2025-05-28T09:55:08Z,http://arxiv.org/pdf/2505.22179v2,"Speculative decoding and quantization effectively accelerate memory-bound inference of large language models. Speculative decoding mitigates the memory bandwidth bottleneck by verifying multiple tokens within a single forward pass, which increases computational effort. Quantization achieves this optimization by compressing weights and activations into lower bit-widths and also reduces computations via low-bit matrix multiplications. To further leverage their strengths, we investigate the integration of these two techniques. Surprisingly, experiments applying the advanced speculative decoding method EAGLE-2 to various quantized models reveal that the memory benefits from 4-bit weight quantization are diminished by the computational load from speculative decoding. Specifically, verifying a tree-style draft incurs significantly more time overhead than a single-token forward pass on 4-bit weight quantized models. This finding led to our new speculative decoding design: a hierarchical framework that employs a small model as an intermediate stage to turn tree-style drafts into sequence drafts, leveraging the memory access benefits of the target quantized model. Experimental results show that our hierarchical approach achieves a 2.78$\times$ speedup across various tasks for the 4-bit weight Llama-3-70B model on an A100 GPU, outperforming EAGLE-2 by 1.31$\times$. Code available at https://github.com/AI9Stars/SpecMQuant."
TabXEval: Why this is a Bad Table? An eXhaustive Rubric for Table   Evaluation,"Vihang Pancholi, Jainit Bafna, Tejas Anvekar, Manish Shrivastava, Vivek Gupta",2025-05-28T09:50:29Z,http://arxiv.org/pdf/2505.22176v1,"Evaluating tables qualitatively & quantitatively presents a significant challenge, as traditional metrics often fail to capture nuanced structural and content discrepancies. To address this, we introduce a novel, methodical rubric integrating multi-level structural descriptors with fine-grained contextual quantification, thereby establishing a robust foundation for comprehensive table comparison. Building on this foundation, we propose TabXEval, an eXhaustive and eXplainable two-phase evaluation framework. TabXEval initially aligns reference tables structurally via TabAlign & subsequently conducts a systematic semantic and syntactic comparison using TabCompare; this approach clarifies the evaluation process and pinpoints subtle discrepancies overlooked by conventional methods. The efficacy of this framework is assessed using TabXBench, a novel, diverse, multi-domain benchmark we developed, featuring realistic table perturbations and human-annotated assessments. Finally, a systematic analysis of existing evaluation methods through sensitivity-specificity trade-offs demonstrates the qualitative and quantitative effectiveness of TabXEval across diverse table-related tasks and domains, paving the way for future innovations in explainable table evaluation."
Reverse Preference Optimization for Complex Instruction Following,"Xiang Huang, Ting-En Lin, Feiteng Fang, Yuchuan Wu, Hangyu Li, Yuzhong Qu, Fei Huang, Yongbin Li",2025-05-28T09:44:27Z,http://arxiv.org/pdf/2505.22172v1,"Instruction following (IF) is a critical capability for large language models (LLMs). However, handling complex instructions with multiple constraints remains challenging. Previous methods typically select preference pairs based on the number of constraints they satisfy, introducing noise where chosen examples may fail to follow some constraints and rejected examples may excel in certain respects over the chosen ones. To address the challenge of aligning with multiple preferences, we propose a simple yet effective method called Reverse Preference Optimization (RPO). It mitigates noise in preference pairs by dynamically reversing the constraints within the instruction to ensure the chosen response is perfect, alleviating the burden of extensive sampling and filtering to collect perfect responses. Besides, reversal also enlarges the gap between chosen and rejected responses, thereby clarifying the optimization direction and making it more robust to noise. We evaluate RPO on two multi-turn IF benchmarks, Sysbench and Multi-IF, demonstrating average improvements over the DPO baseline of 4.6 and 2.5 points (on Llama-3.1 8B), respectively. Moreover, RPO scales effectively across model sizes (8B to 70B parameters), with the 70B RPO model surpassing GPT-4o."
ReliableEval: A Recipe for Stochastic LLM Evaluation via Method of   Moments,"Gili Lior, Eliya Habba, Shahar Levy, Avi Caciularu, Gabriel Stanovsky",2025-05-28T09:40:48Z,http://arxiv.org/pdf/2505.22169v1,"LLMs are highly sensitive to prompt phrasing, yet standard benchmarks typically report performance using a single prompt, raising concerns about the reliability of such evaluations. In this work, we argue for a stochastic method of moments evaluation over the space of meaning-preserving prompt perturbations. We introduce a formal definition of reliable evaluation that accounts for prompt sensitivity, and suggest ReliableEval - a method for estimating the number of prompt resamplings needed to obtain meaningful results. Using our framework, we stochastically evaluate five frontier LLMs and find that even top-performing models like GPT-4o and Claude-3.7-Sonnet exhibit substantial prompt sensitivity. Our approach is model-, task-, and metric-agnostic, offering a recipe for meaningful and robust LLM evaluation."
Unifying Continuous and Discrete Text Diffusion with Non-simultaneous   Diffusion Processes,"Bocheng Li, Zhujin Gao, Linli Xu",2025-05-28T09:28:52Z,http://arxiv.org/pdf/2505.22165v1,"Diffusion models have emerged as a promising approach for text generation, with recent works falling into two main categories: discrete and continuous diffusion models. Discrete diffusion models apply token corruption independently using categorical distributions, allowing for different diffusion progress across tokens but lacking fine-grained control. Continuous diffusion models map tokens to continuous spaces and apply fine-grained noise, but the diffusion progress is uniform across tokens, limiting their ability to capture semantic nuances. To address these limitations, we propose \textbf{\underline{N}}on-simultan\textbf{\underline{e}}ous C\textbf{\underline{o}}ntinuous \textbf{\underline{Diff}}usion Models (NeoDiff), a novel diffusion model that integrates the strengths of both discrete and continuous approaches. NeoDiff introduces a Poisson diffusion process for the forward process, enabling a flexible and fine-grained noising paradigm, and employs a time predictor for the reverse process to adaptively modulate the denoising progress based on token semantics. Furthermore, NeoDiff utilizes an optimized schedule for inference to ensure more precise noise control and improved performance. Our approach unifies the theories of discrete and continuous diffusion models, offering a more principled and effective framework for text generation. Experimental results on several text generation tasks demonstrate NeoDiff's superior performance compared to baselines of non-autoregressive continuous and discrete diffusion models, iterative-based methods and autoregressive diffusion-based methods. These results highlight NeoDiff's potential as a powerful tool for generating high-quality text and advancing the field of diffusion-based text generation."
Stratified Selective Sampling for Instruction Tuning with Dedicated   Scoring Strategy,"Paramita Mirza, Lucas Weber, Fabian Küch",2025-05-28T09:22:25Z,http://arxiv.org/pdf/2505.22157v1,"Recent work shows that post-training datasets for LLMs can be substantially downsampled without noticeably deteriorating performance. However, data selection often incurs high computational costs or is limited to narrow domains. In this paper, we demonstrate that data selection can be both -- efficient and universal -- by using a multi-step pipeline in which we efficiently bin data points into groups, estimate quality using specialized models, and score difficulty with a robust, lightweight method. Task-based categorization allows us to control the composition of our final data -- crucial for finetuning multi-purpose models. To guarantee diversity, we improve upon previous work using embedding models and a clustering algorithm. This integrated strategy enables high-performance fine-tuning with minimal overhead."
InComeS: Integrating Compression and Selection Mechanisms into LLMs for   Efficient Model Editing,"Shuaiyi Li, Zhisong Zhang, Yang Deng, Chenlong Deng, Tianqing Fang, Hongming Zhang, Haitao Mi, Dong Yu, Wai Lam",2025-05-28T09:20:18Z,http://arxiv.org/pdf/2505.22156v1,"Although existing model editing methods perform well in recalling exact edit facts, they often struggle in complex scenarios that require deeper semantic understanding rather than mere knowledge regurgitation. Leveraging the strong contextual reasoning abilities of large language models (LLMs), in-context learning (ICL) becomes a promising editing method by comprehending edit information through context encoding. However, this method is constrained by the limited context window of LLMs, leading to degraded performance and efficiency as the number of edits increases. To overcome this limitation, we propose InComeS, a flexible framework that enhances LLMs' ability to process editing contexts through explicit compression and selection mechanisms. Specifically, InComeS compresses each editing context into the key-value (KV) cache of a special gist token, enabling efficient handling of multiple edits without being restricted by the model's context window. Furthermore, specialized cross-attention modules are added to dynamically select the most relevant information from the gist pools, enabling adaptive and effective utilization of edit information. We conduct experiments on diverse model editing benchmarks with various editing formats, and the results demonstrate the effectiveness and efficiency of our method."
Improving Brain-to-Image Reconstruction via Fine-Grained Text Bridging,"Runze Xia, Shuo Feng, Renzhi Wang, Congchi Yin, Xuyun Wen, Piji Li",2025-05-28T09:16:44Z,http://arxiv.org/pdf/2505.22150v2,"Brain-to-Image reconstruction aims to recover visual stimuli perceived by humans from brain activity. However, the reconstructed visual stimuli often missing details and semantic inconsistencies, which may be attributed to insufficient semantic information. To address this issue, we propose an approach named Fine-grained Brain-to-Image reconstruction (FgB2I), which employs fine-grained text as bridge to improve image reconstruction. FgB2I comprises three key stages: detail enhancement, decoding fine-grained text descriptions, and text-bridged brain-to-image reconstruction. In the detail-enhancement stage, we leverage large vision-language models to generate fine-grained captions for visual stimuli and experimentally validate its importance. We propose three reward metrics (object accuracy, text-image semantic similarity, and image-image semantic similarity) to guide the language model in decoding fine-grained text descriptions from fMRI signals. The fine-grained text descriptions can be integrated into existing reconstruction methods to achieve fine-grained Brain-to-Image reconstruction."
Flexible Tool Selection through Low-dimensional Attribute Alignment of   Vision and Language,"Guangfu Hao, Haojie Wen, Liangxuna Guo, Yang Chen, Yanchao Bi, Shan Yu",2025-05-28T09:06:04Z,http://arxiv.org/pdf/2505.22146v1,"Flexible tool selection reflects a complex cognitive ability that distinguishes humans from other species, yet computational models that capture this ability remain underdeveloped. We developed a framework using low-dimensional attribute representations to bridge visual tool perception and linguistic task understanding. We constructed a comprehensive dataset (ToolNet) containing 115 common tools labeled with 13 carefully designed attributes spanning physical, functional, and psychological properties, paired with natural language scenarios describing tool usage. Visual encoders (ResNet or ViT) extract attributes from tool images while fine-tuned language models (GPT-2, LLaMA, DeepSeek) derive required attributes from task descriptions. Our approach achieves 74% accuracy in tool selection tasks-significantly outperforming direct tool matching (20%) and smaller multimodal models (21%-58%), while approaching performance of much larger models like GPT-4o (73%) with substantially fewer parameters. Ablation studies revealed that manipulation-related attributes (graspability, hand-relatedness, elongation) consistently prove most critical across modalities. This work provides a parameter-efficient, interpretable solution that mimics human-like tool cognition, advancing both cognitive science understanding and practical applications in tool selection tasks."
Benchmarking Abstract and Reasoning Abilities Through A Theoretical   Perspective,"Qingchuan Ma, Yuhang Wu, Xiawu Zheng, Rongrong Ji",2025-05-28T09:02:45Z,http://arxiv.org/pdf/2505.23833v1,"In this paper, we aim to establish a simple, effective, and theoretically grounded benchmark for rigorously probing abstract reasoning in Large Language Models (LLMs). To achieve this, we first develop a mathematic framework that defines abstract reasoning as the ability to: (i) extract essential patterns independent of surface representations, and (ii) apply consistent rules to these abstract patterns. Based on this framework, we introduce two novel complementary metrics: \(\scoreGamma\) measures basic reasoning accuracy, while \(\scoreDelta\) quantifies a model's reliance on specific symbols rather than underlying patterns - a key indicator of true abstraction versus mere memorization. To implement this measurement, we design a benchmark: systematic symbol remapping in rule-based tasks, which forces models to demonstrate genuine pattern recognition beyond superficial token matching. Extensive LLM evaluations using this benchmark (commercial API models, 7B-70B, multi-agent) reveal:1) critical limitations in non-decimal arithmetic and symbolic reasoning; 2) persistent abstraction gaps despite chain-of-thought prompting; and 3) \(\scoreDelta\)'s effectiveness in robustly measuring memory dependence by quantifying performance degradation under symbol remapping, particularly highlighting operand-specific memorization. These findings underscore that current LLMs, despite domain-specific strengths, still lack robust abstract reasoning, highlighting key areas for future improvement."
LegalSearchLM: Rethinking Legal Case Retrieval as Legal Elements   Generation,"Chaeeun Kim, Jinu Lee, Wonseok Hwang",2025-05-28T09:02:41Z,http://arxiv.org/pdf/2505.23832v1,"Legal Case Retrieval (LCR), which retrieves relevant cases from a query case, is a fundamental task for legal professionals in research and decision-making. However, existing studies on LCR face two major limitations. First, they are evaluated on relatively small-scale retrieval corpora (e.g., 100-55K cases) and use a narrow range of criminal query types, which cannot sufficiently reflect the complexity of real-world legal retrieval scenarios. Second, their reliance on embedding-based or lexical matching methods often results in limited representations and legally irrelevant matches. To address these issues, we present: (1) LEGAR BENCH, the first large-scale Korean LCR benchmark, covering 411 diverse crime types in queries over 1.2M legal cases; and (2) LegalSearchLM, a retrieval model that performs legal element reasoning over the query case and directly generates content grounded in the target cases through constrained decoding. Experimental results show that LegalSearchLM outperforms baselines by 6-20% on LEGAR BENCH, achieving state-of-the-art performance. It also demonstrates strong generalization to out-of-domain cases, outperforming naive generative models trained on in-domain data by 15%."
